	title	sentences	label	language	index
16	Cybervictimization in adolescence and its association with subsequent suicidal ideation/attempt beyond face‐to‐face victimization : a longitudinal population‐based study	Background Cross‐sectional associations have been documented between cybervictimization and suicidal risk; however, prospective associations remain unclear.  Methods Participants were members of the Quebec Longitudinal Study of Child Development (QLSCD), a prospective birth cohort of 2,120 individuals followed from birth (1997/98) to age 17 years (2014/15). Cybervictimization and face‐to‐face victimization experienced since the beginning of the school year, as well as serious suicidal ideation and/or suicide attempt were self‐reported at ages 13, 15 and 17 years.  Results In cross‐sectional analyses at 13, 15 and 17 years, adolescents cybervictimized at least once had, respectively, 2.3 (95% CI = 1.64–3.19), 4.2 (95% CI = 3.27–5.41) and 3.5 (95% CI = 2.57–4.66) higher odds of suicidal ideation/attempt after adjusting for confounders including face‐to‐face victimization, prior mental health symptoms and family hardship. Sensitivity analyses suggested that cybervictimization only and both cyber‐ and face‐to‐face victimization were associated with a higher risk of suicidal ideation/attempt compared to face‐to‐face victimization only and no victimization; however, analyses were based on small n. In prospective analyses, cybervictimization was not associated with suicidal ideation/attempt 2 years later after accounting for baseline suicidal ideation/attempt and other confounders. In contrast, face‐to‐face victimization was associated with suicidal ideation/attempt 2 years later in the fully adjusted model, including cybervictimization.  Conclusions The cross‐sectional association between cybervictimization and suicidal ideation/attempt is independent from face‐to‐face victimization. The absence of a prospective association suggested short‐term effects of cybervictimization on suicidal ideation/attempt.	Adolescence , Longitudinal cohort , Suicidal ideation , Suicide attempt , Quebec Longitudinal Study of Child Development	en	24968.0
17	Associations between developmental trajectories of peer victimization, hair cortisol, and depressive symptoms : a longitudinal study	Background Peer victimization has been associated with long‐lasting risks for mental health. Prior research suggests that stress‐related systems underlying adaptation to changing environments may be at play. To date, inconsistent findings have been reported for the hypothalamic–pituitary–adrenal (HPA) axis, and its end product cortisol. This study tested whether peer victimization was associated with hair cortisol concentrations (HCC), and whether this association varied according to sex, timing, and changes in exposure. We also examined whether peer victimization differentially predicted depressive symptoms according to HCC.  Methods The sample comprised 556 adolescents (42.0%; 231 males) who provided hair for cortisol measurement at 17 years of age. Peer victimization was reported at seven occasions between the ages of 6 and 15 years.  Results Peer victimization was nonlinearly associated with HCC for boys only, whereas changes in peer victimization were related to HCC for boys and girls. Peer victimization predicted more depressive symptoms for all participants, except those with lower HCC.  Conclusions Our findings provide further support for persistent dysregulation of the HPA axis following exposure to chronic adversity, of which the expression may change according to sex and the severity of victimization.	Peer victimization , HPA axis , Hair cortisol , Depression , Nonlinear models	en	24967.0
18	A comparative tale of two methods : how thematic and narrative analyses author the data story differently	An interpretive qualitative approach insists on the plural and negotiated nature of the meanings that humans attach to their social realities. Thus, the qualitative researcher must navigate multiple and sometimes conflicting commitments to method, data, oneself, participants, and one’s reader. This can lead us to obscure the messiness of data analysis in final research reports and to downplay how methodological choices can make our participants ‘say things.’ In this article, we compare two interpretive methods, thematic and narrative analysis, including their shared epistemological and ontological premises, and offer a pedagogical demonstration of their application to the same data excerpt. However, our broader goal is to use the divergent results to critically examine how our choice of analytic method in interpretive research influences how we (researcher + method) ‘author’ data stories. Ultimately, researcher reflexivity must go beyond acknowledging how one’s position may influence the data analysis or the participant.	Interpretive research , Qualitative research , Thematic analysis , Narrative analysis , Researcher commitments	en	24965.0
19	Cannabis use, depression and suicidal ideation in adolescence : direction of associations in a population based cohort	Background To clarify the direction of the association between frequency of cannabis use, depressive symptoms and suicidal ideation from 15 to 20 years using cross-lagged analyses.  Method We included 1606 adolescents from the province of Québec followed since 1997 with information on frequency of cannabis use (none/monthly/weekly), depression (defined as being in the top 10% symptoms) and serious suicidal ideation at ages 15, 17 and 20 years.  Results The prevalence of weekly cannabis use increased from 7.0% at age 15 years to 15.6% by age 20 years. Adolescents who reported using cannabis weekly at one age were 11 to 15 times more likely to continue using cannabis over time. In longitudinal cross-lagged analyses, weekly cannabis use at age 15 was associated with greater odds (OR=2.19, 95% CI=1.04-4.58) of suicidal ideation two years later. However, other substance use (alcohol, tobacco, other drugs) fully explained this association. Further, depression predicted subsequent weekly cannabis use, even after adjusting for comorbid other substance use (eg, for depression at 15 years predicting cannabis use at 17 years: OR=2.30, 95% CI=1.19-4.43).  Limitations Quantity of cannabis consumed was not measured.  Conclusion Findings suggest that depressive symptoms in adolescence may represent a risk factor for weekly cannabis consumption, which once initiated is likely to remain chronic. Weekly cannabis use increased risk for suicidal ideation, but not independently from other substance use including alcohol, tobacco and other drugs.	Longitudinal , Adolescence , Cannabis , Depression , Suicidal ideation , Substance use	en	24963.0
20	Contribution of genes and environment to the longitudinal association between childhood impulsive‐aggression and suicidality in adolescence	Background Population‐based and family studies showed that impulsive‐aggression predicts suicidality; however, the underlying etiological nature of this association is poorly understood. The objective was to determine the contribution of genes and environment to the association between childhood impulsive‐aggression and serious suicidal ideation/attempt in young adulthood.  Methods N = 862 twins (435 families) from the Quebec Newborn Twin Study were followed up from birth to 20 years. Repeated measures of teacher‐assessed impulsive‐aggression were modeled using a genetically informed latent growth model including intercept and slope parameters reflecting individual differences in the baseline level (age 6 years) and in the change (increase/decrease) of impulsive‐aggression during childhood (6 to 12 years), respectively. Lifetime suicidality (serious suicidal ideation/attempt) was self‐reported at 20 years. Associations of impulsive‐aggression intercept and slope with suicidality were decomposed into additive genetic (A) and unique environmental (E) components.  Results Additive genetic factors accounted for an important part of individual differences in impulsive‐aggression intercept (A = 90%, E = 10%) and slope (A = 65%, E = 35%). Genetic (50%) and unique environmental (50%) factors equally contributed to suicidality. We found that 38% of the genetic factors accounting for suicidality were shared with those underlying impulsive‐aggression slope, whereas 40% of the environmental factors accounting for suicidality were shared with those associated with impulsive‐aggression intercept. The genetic correlation between impulsive‐aggression slope and suicidality was 0.60, p = .027.  Conclusions Genetic and unique environmental factors underlying suicidality significantly overlap with those underlying childhood impulsive‐aggression. Future studies should identify putative genetic and environmental factors to inform prevention.	Suicide attempt , Suicidal ideation , Impulsive-aggression , Twin study , Behavioral genetics , Longitudinal	en	24962.0
21	Associations between peer victimization and suicidal ideation and suicide attempt during adolescence : results from a prospective population-based birth cohort	Objective:To test whether adolescents who are victim-ized by peers are at heightened risk for suicidal ideationand  suicide  attempt,  using  both  cross-sectional  andprospective investigations.Method:Participants are from the Quebec LongitudinalStudy of Child Development, a general population sampleof children born in Quebec in 1997 through 1998 andfollowed up until 15 years of age. Information aboutvictimization and serious suicidal ideation and suicideattempt in the past year was obtained at ages 13 and15 years from self-reports (N¼1,168).Results:Victims reported concurrently higher rates ofsuicidal ideation at age 13 years (11.6–14.7%) and suicideattempt at age 15 years (5.4–6.8%) compared to those whohad not been victimized (2.7–4.1% for suicidal ideationand 1.6–1.9% for suicide attempt). Being victimized bypeers at 13 years predicted suicidal ideation (odds ratio[OR]¼2.27;  95%  CI¼1.25–4.12)  and  suicideattempt (OR¼3.05, 95% CI¼1.36–6.82) 2 years later,even  after  adjusting  for  baseline  suicidality  andmental health problems and a series of confounders(socioeconomic status, intelligence, family’s functioningand structure, hostile-reactive parenting, maternal lifetimesuicidal  ideation/suicide  attempt).  Those  who  werevictimized at both 13 and 15 years had the highest risk ofsuicidal ideation (OR¼5.41, 95% CI¼2.53–11.53) andsuicide attempt (OR¼5.85, 95% CI¼2.12–16.18) at15 years.Conclusion:Victimization is associated with an increasedrisk of suicidal ideation and suicide attempt over andabove concurrent suicidality and prior mental healthproblems. The longer the history of victimization, thegreater the risk.	Suicidal ideation , Suicide attempt , Adolescence , Peer victimization , Bullying	en	24961.0
22	Newborn screening for congenital hypothyroidism and congenital adrenal hyperplasia : the balance of benefits and costs of a public health success	Newborn screening is an important public health program and a triumph of preventive medicine. Economic analyses show that the benefits of newborn screening clearly outweigh the  costs for certain diseases but not necessarily for other ones. This is due to the great diversity of the  natural history of the diseases detected, to the fact that each of these diseases considered  individually is rare, and to differences in the effectiveness of interventions. In addition, the benefit cost ratio of screening for a particular disorder may differ between countries, specifically between high-income and low- and middle-income countries. The burden of a disorder may also be alleviated by increased clinical awareness and effective clinical services, even in the absence of newborn screening. In this article, the authors focus on economic analyses of newborn screening  for primary congenital hypothyroidism, which has been in place in high-income countries for  roughly 40 years, and for classic congenital adrenal hyperplasia due to 21-hydroxylase deficiency. Screening for the latter is not yet universal, even in high-income countries, although the lack of universal implementation may reflect factors other than economic considerations.		en	24960.0
23	Rome en ses jardins : paysage et pouvoir au XVIe siècle	L'auteur revisite les rapports entre pays et paysage à la lumière d'une histoire de l'art d'orientation anthropologique centrée sur la notion de pouvoir et sur les enjeux sociaux du territoire.		fr	24959.0
24	La nucléation à partir de cristaux mixtes : une nouvelle approche pour augmenter la diversité polymorphique	Les composés qui existent sous de multiples formes cristallines sont qualifiés de polymorphiques. Les polymorphes ont la même composition, mais leurs structures et leurs propriétés peuvent varier significativement. Dans de nombreux domaines, les conditions de cristallisation des composés d’intérêt sont étudiées de façon exhaustive afin de générer autant de polymorphes que possible, à partir desquels le polymorphe le plus avantageux pour l’application souhaitée peut être sélectionné. Nous rapportons une nouvelle façon d’augmenter la diversité polymorphique basée sur la cristallisation induite par l’ensemencement à l’aide de cristaux mixtes. Nous rapportons également une nouvelle stratégie de cristallisation de composés fondus suspendus qui permet d’induire la formation de cristaux uniques qui sont trop instables pour être produits par des méthodes traditionnelles. Cette stratégie permet la résolution par diffraction des rayons X d’une plus large variété de structures cristallines. L’efficacité des méthodes présentées ci-dessus a été démontrée en les utilisant pour produire des cristaux uniques caractérisés par diffraction des rayons X de nouveaux polymorphes du composé ROY, une référence en matière de polymorphisme. Cela permet à ROY de regagner sa part de la position de composé le plus polymorphique dans la Cambridge Structural Database (CSD).	ROY , Polymorphisme , Polymorphe , Ensemencement , Cristaux , Nucléation , Cristallisation , Structure cristalline , Polymorphism , Polymorph , Seeding , Crystal , Crystallization , Crystalline structure , Chemistry - Organic / Chimie organique (UMI : 0490)	fr	24957.0
25	La nucléation à partir de cristaux mixtes : une nouvelle approche pour augmenter la diversité polymorphique	Chemical compounds that exist in multiple crystalline forms are said to exhibit polymorphism. Polymorphs have the same composition, but their structures and properties can vary markedly. In many fields, conditions for crystallizing compounds of interest are screened exhaustively to generate as many polymorphs as possible, from which the most advantageous form for the desired application can be selected. Here we report a new way to increase polymorphic diversity, based on crystallization induced by suitably designed mixed-crystal seeds. Also reported herein is a new strategy of suspended-melt crystallization, which can be used to induce the formation of single crystals that are too unstable to be produced by traditional methods. This strategy allows for a broader scope of crystalline structures to be resolved by X-ray diffraction. The efficacy of the above methods has been demonstrated by using them to produce new polymorphs of the benchmark compound ROY as single crystals structurally characterized by X-ray diffraction. This allows ROY to reclaim a share of the crown as the most polymorphic compound in the Cambridge Structural Database (CSD).	ROY , Polymorphisme , Polymorphe , Ensemencement , Cristaux , Nucléation , Cristallisation , Structure cristalline , Polymorphism , Polymorph , Seeding , Crystal , Crystallization , Crystalline structure , Chemistry - Organic / Chimie organique (UMI : 0490)	en	24957.0
26	Prospective randomized clinical trial evaluating the effects of two different implant collar designs on peri‐implant healing and functional osseointegration after 25 years	Objectives Evaluate the effects of two different machined‐collar lengths and designs on peri‐implant healing.  Material and Methods An implant with a microtextured surface and 3.6mm‐long internal‐connection machined collar was compared to two implants that had an identical 1.2mm‐long external‐connection machined collar, but one had the microtextured surface while the other's was machined. Participants received the three implants, with microgap at the crest, alternately at five sites between mental foramen, and a full‐arch prosthesis. Peri‐implant bone levels were measured after 23 to 26 years of function. Keratinized tissue height, plaque, probing depth, bleeding, and purulence were also evaluated. Descriptive and mixed models for repeated\measures analyses were used, with Bonferroni correction for pairwise comparisons.  Results Twenty‐two participants (110 implants) were evaluated at the 25‐year examination. Microtextured implants with the longer machined collar had significantly greater mean marginal bone loss (−1.77mm ± 0.18, mean ± SE) than machined (−0.85mm ± 0.18, p < .001) and microtextured (−1.00 ± 0.18mm, p < .001) implants with the shorter machined collar. Keratinized tissue height was greater for internal‐connection (0.74mm ± 0.10) versus external‐connection (0.51 ± 0.08, p =  0.01) microtextured implants. No differences were observed for plaque (p = 0.78), probing depth (p = 0.42), bleeding (p  = 0.07), and purulence (p = 1.00). Implant survival rate was 99%.  Conclusions Implants with the 1.2mm machined collar limited bone loss to 1mm, while those with the longer machined collar showed > 1.5mm loss after 25 years of function with microgap at the crest. Internal‐connection design and fixture surface microtexturing did not result in greater bone preservation.	Bone-implant interactions , Clinical research/Clinical trials , Periodontology , Prosthodontics , Soft-tissue-implant interactions , Surface chemistry , Surgical techniques , Biomechanics/Finite element analysis	en	24955.0
27	Recueil des résumés : 1er symposium étudiant de l’École de réadaptation de l’Université de Montréal : apprendre à communiquer la recherche pour en optimiser les retombées, En ligne, 3 septembre 2020	Le Symposium étudiant de l’École de réadaptation de l’Université de Montréal est un évènement scientifique organisé par des étudiantes et étudiants des programmes de maitrise et de doctorat en sciences de la réadaptation. Il est ouvert à tous les membres étudiants et stagiaires postdoctoraux de la communauté universitaire des sciences de la santé de l'Université de Montréal (ergothérapie, physiothérapie, sciences de la réadaptation, orthophonie, audiologie, nutrition, kinésiologie). La première édition, intitulée « Apprendre à communiquer la recherche pour en optimiser les retombées », a eu lieu en ligne le 3 septembre 2020. Au cours de cette demi- journée, 17 étudiantes et étudiants de deuxième ou troisième cycle ont présenté leurs travaux portant sur la réadaptation. Les communications étaient sous forme de présentations orales vulgarisées de 3 minutes. Une conférence sur la vulgarisation scientifique aux études supérieures a également été présentée par Christophe Alarie, kinésiologue et étudiant au doctorat en sciences de la réadaptation. Le symposium était organisé en collaboration avec la direction de l'École de réadaptation de l'Université de Montréal et a reçu un financement de la FAÉCUM, du FICSUM et du Fonds d’amélioration de la vie étudiante de l’Université de Montréal.	Réadaptation , Adaptation , Innovation , Vulgarisation scientifique	fr	24954.0
28	Inclusion of relatives in stroke rehabilitation : Perception of quality of services they received in the context of early supported discharged (ESD), in- and out-patient services	Background Relatives of stroke patients should be an integral part of the continuum of rehabilitation services.  Objective The objective was to describe their perception of the quality of the services they received in the context of early supported discharged (ESD), in- and out-patient rehabilitation services.  Methods Descriptive study using the Quality of Services Questionnaire for Relatives post-stroke (QSQR) completed online by relatives after the patient’s discharge. It consists of 22 statements with respect to three subscales: 1) the training/instructions, 2) the information provision and 3) the organizational process of the service offer. Space is allowed for free comments and two open-ended questions. Quantitative data were analyzed descriptively, and we used a content analysis for qualitative data.  Results One-third (30/90; 33.3%) of the sample are composed of relatives aged 55 and under, with a majority (81%) of women and 51.3% of spouses. The training/instructions and information provision were perceived positively with a mean % agreement at 85.0 ± 29.6 and 84.8 ± 22.4, respectively. The mean % agreement was 91.4 ± 17.8 for the organizational process subscale. A significantly higher score (p = 0,03; Kruskal Wallis test) was found for out-patient services (n = 20) as compared to ESD (n = 29) or in-patient rehabilitation (n = 41). Qualitatively, a lack of involvement of relatives was mentioned as well as a lack of personalized information about stroke and its consequences and provision of resources available. However, communication between professionals, their availability, and their professionalism were appreciated.  Conclusion Despite quantitative high scores, qualitative data allowed the identification of concrete avenues for improvement to truly and systematically include relatives in stroke rehabilitation.	Stroke , Rehabilitation , Relatives , Quality of services , Early supported discharged , Information and training	en	24953.0
29	"Effects of dopamine receptor antagonism and
amphetamine-induced psychomotor sensitization on
sign- and goal-tracking after extended training"	The dopamine system is important for incentive salience attribution, where motivational value is assigned to conditioned cues that predict appetitive reinforcers. However, the role of dopamine in this process may change with extended training. We tested the effects of dopamine D1-like and D2-like receptor antagonism on the expression of sign-tracking and goal-tracking conditioned responses following extended Pavlovian conditioned approach (PCA) training. We also tested if amphetamine-induced psychomotor sensitization accelerates the enhanced acquisition of sign-tracking that is observed with extended training. In experiment 1, 24 male Long-Evans rats received 20 PCA sessions in which one lever (CS+, 10 s) predicted 0.2 ml sucrose (10 %, w/v) delivery and the other lever (CS–) did not. SCH-23390 (D1-like antagonist) or eticlopride (D2-like antagonist) were administered before non-reinforced behavioural tests at doses of 0, 0.01, and 0.1 mg/kg (s.c.). In experiment 2, rats received vehicle or 2 mg/kg amphetamine (i.p.) for 7 days (n = 12/group). Ten days later, they received 16 PCA training sessions. Both doses of SCH-23390 reduced sign- and goal-tracking, but also reduced locomotor behaviour. A low dose of eticlopride (0.01 mg/kg) selectively reduced goal-tracking, without affecting sign-tracking or locomotor behaviour. Amphetamine produced psychomotor sensitization, and this did not affect the acquisition of sign- or goal-tracking. Following extended PCA training, dopamine D2-like receptor activity is required for the expression of goal-tracking but not sign-tracking. Psychomotor sensitization to amphetamine did not impact incentive salience attribution; however, more selective manipulations of the dopamine system may be needed.	Autoshaping , Pavlovian conditioned approach , Sign-tracking , SCH-23390 , Eticlopride , Amphetamine	en	24952.0
30	Enhancing relationships between criminology and cybersecurity	‘Cybercrime’ is an umbrella concept used by criminologists to refer to traditional crimes that are enhanced via the use of networked technologies (i.e. cyber-enabled crimes) and newer forms of crime that would not exist without networked technologies (i.e. cyber-dependent crimes). Cybersecurity is similarly a very broad concept and diverse field of practice. For computer scientists, the term ‘cybersecurity’ typically refers to policies, processes and practices undertaken to protect data, networks and systems from unauthorised access. Cybersecurity is used in subnational, national and transnational contexts to capture an increasingly diverse array of threats. Increasingly, cybercrimes are presented as threats to cybersecurity, which explains why national security institutions are gradually becoming involved in cybercrime control and prevention activities. This paper argues that the fields of cyber-criminology and cybersecurity, which are segregated at the moment, are in much need of greater engagement and cross-fertilisation. We draw on concepts of ‘high’ and ‘low’ policing (Brodeur, 2010) to suggest it would be useful to consider ‘crime’ and ‘security’ on the same continuum. This continuum has cybercrime at one end and cybersecurity at the other, with crime being more the domain of ‘low’ policing while security, as conceptualised in the context of specific cybersecurity projects, falls under the responsibility of ‘high’ policing institutions. This unifying approach helps us to explore the fuzzy relationship between cyber-crime and cyber-security and to call for more fruitful alliances between cybercrime and cybersecurity researchers.	Cybercrime , Cyber harms , Cybersecurity , Criminology , Networks , Security , Security actors	en	24951.0
